[2024-06-10 17:52:05,298][flwr][INFO] - Starting Flower simulation, config: num_rounds=10, no round_timeout
[2024-06-10 17:52:07,334][flwr][INFO] - Flower VCE: Ray initialized with resources: {'node:10.250.130.147': 1.0, 'CPU': 16.0, 'node:__internal_head__': 1.0, 'object_store_memory': 6871891968.0, 'memory': 13743783936.0}
[2024-06-10 17:52:07,335][flwr][INFO] - Optimize your simulation with Flower VCE: https://flower.ai/docs/framework/how-to-run-simulations.html
[2024-06-10 17:52:07,335][flwr][INFO] - No `client_resources` specified. Using minimal resources for clients.
[2024-06-10 17:52:07,335][flwr][INFO] - Flower VCE: Resources for each Virtual Client: {'num_cpus': 1, 'num_gpus': 0.0}
[2024-06-10 17:52:07,344][flwr][INFO] - Flower VCE: Creating VirtualClientEngineActorPool with 16 actors
[2024-06-10 17:52:07,345][flwr][INFO] - [INIT]
[2024-06-10 17:52:07,345][flwr][INFO] - Requesting initial parameters from one random client
[2024-06-10 17:52:09,401][flwr][INFO] - Received initial parameters from one random client
[2024-06-10 17:52:09,401][flwr][INFO] - Evaluating initial global parameters
[2024-06-10 17:52:10,508][flwr][INFO] - initial parameters (loss, other metrics): 182.1829071044922, {'accuracy': 0.132}
[2024-06-10 17:52:10,509][flwr][INFO] - 
[2024-06-10 17:52:10,509][flwr][INFO] - [ROUND 1]
[2024-06-10 17:52:10,509][flwr][INFO] - configure_fit: strategy sampled 10 clients (out of 100)
[2024-06-10 17:52:13,299][flwr][INFO] - aggregate_fit: received 10 results and 0 failures
[2024-06-10 17:52:13,303][flwr][WARNING] - No fit_metrics_aggregation_fn provided
[2024-06-10 17:52:14,372][flwr][INFO] - fit progress: (1, 181.77241969108582, {'accuracy': 0.1477}, 3.8638854839955457)
[2024-06-10 17:52:14,373][flwr][INFO] - configure_evaluate: no clients selected, skipping evaluation
[2024-06-10 17:52:14,373][flwr][INFO] - 
[2024-06-10 17:52:14,373][flwr][INFO] - [ROUND 2]
[2024-06-10 17:52:14,373][flwr][INFO] - configure_fit: strategy sampled 10 clients (out of 100)
[2024-06-10 17:52:15,614][flwr][INFO] - aggregate_fit: received 10 results and 0 failures
[2024-06-10 17:52:16,770][flwr][INFO] - fit progress: (2, 181.3817048072815, {'accuracy': 0.1612}, 6.261833643999125)
[2024-06-10 17:52:16,771][flwr][INFO] - configure_evaluate: no clients selected, skipping evaluation
[2024-06-10 17:52:16,771][flwr][INFO] - 
[2024-06-10 17:52:16,771][flwr][INFO] - [ROUND 3]
[2024-06-10 17:52:16,771][flwr][INFO] - configure_fit: strategy sampled 10 clients (out of 100)
[2024-06-10 17:52:17,757][flwr][INFO] - aggregate_fit: received 10 results and 0 failures
[2024-06-10 17:52:18,880][flwr][INFO] - fit progress: (3, 181.00767374038696, {'accuracy': 0.1636}, 8.371722137999313)
[2024-06-10 17:52:18,880][flwr][INFO] - configure_evaluate: no clients selected, skipping evaluation
[2024-06-10 17:52:18,880][flwr][INFO] - 
[2024-06-10 17:52:18,881][flwr][INFO] - [ROUND 4]
[2024-06-10 17:52:18,881][flwr][INFO] - configure_fit: strategy sampled 10 clients (out of 100)
[2024-06-10 17:52:19,825][flwr][INFO] - aggregate_fit: received 10 results and 0 failures
[2024-06-10 17:52:20,913][flwr][INFO] - fit progress: (4, 180.63748693466187, {'accuracy': 0.173}, 10.40403688600054)
[2024-06-10 17:52:20,913][flwr][INFO] - configure_evaluate: no clients selected, skipping evaluation
[2024-06-10 17:52:20,913][flwr][INFO] - 
[2024-06-10 17:52:20,913][flwr][INFO] - [ROUND 5]
[2024-06-10 17:52:20,913][flwr][INFO] - configure_fit: strategy sampled 10 clients (out of 100)
[2024-06-10 17:52:21,865][flwr][INFO] - aggregate_fit: received 10 results and 0 failures
[2024-06-10 17:52:22,949][flwr][INFO] - fit progress: (5, 180.26483249664307, {'accuracy': 0.1887}, 12.440102611995826)
[2024-06-10 17:52:22,949][flwr][INFO] - configure_evaluate: no clients selected, skipping evaluation
[2024-06-10 17:52:22,949][flwr][INFO] - 
[2024-06-10 17:52:22,949][flwr][INFO] - [ROUND 6]
[2024-06-10 17:52:22,949][flwr][INFO] - configure_fit: strategy sampled 10 clients (out of 100)
[2024-06-10 17:52:23,875][flwr][INFO] - aggregate_fit: received 10 results and 0 failures
[2024-06-10 17:52:24,937][flwr][INFO] - fit progress: (6, 179.86753463745117, {'accuracy': 0.2069}, 14.428454148001038)
[2024-06-10 17:52:24,937][flwr][INFO] - configure_evaluate: no clients selected, skipping evaluation
[2024-06-10 17:52:24,937][flwr][INFO] - 
[2024-06-10 17:52:24,937][flwr][INFO] - [ROUND 7]
[2024-06-10 17:52:24,937][flwr][INFO] - configure_fit: strategy sampled 10 clients (out of 100)
[2024-06-10 17:52:25,847][flwr][INFO] - aggregate_fit: received 10 results and 0 failures
[2024-06-10 17:52:26,913][flwr][INFO] - fit progress: (7, 179.4246232509613, {'accuracy': 0.2217}, 16.404349169999477)
[2024-06-10 17:52:26,913][flwr][INFO] - configure_evaluate: no clients selected, skipping evaluation
[2024-06-10 17:52:26,913][flwr][INFO] - 
[2024-06-10 17:52:26,913][flwr][INFO] - [ROUND 8]
[2024-06-10 17:52:26,913][flwr][INFO] - configure_fit: strategy sampled 10 clients (out of 100)
[2024-06-10 17:52:27,845][flwr][INFO] - aggregate_fit: received 10 results and 0 failures
[2024-06-10 17:52:28,907][flwr][INFO] - fit progress: (8, 178.9228160381317, {'accuracy': 0.2312}, 18.39809763499943)
[2024-06-10 17:52:28,907][flwr][INFO] - configure_evaluate: no clients selected, skipping evaluation
[2024-06-10 17:52:28,907][flwr][INFO] - 
[2024-06-10 17:52:28,907][flwr][INFO] - [ROUND 9]
[2024-06-10 17:52:28,907][flwr][INFO] - configure_fit: strategy sampled 10 clients (out of 100)
[2024-06-10 17:52:29,859][flwr][INFO] - aggregate_fit: received 10 results and 0 failures
[2024-06-10 17:52:30,925][flwr][INFO] - fit progress: (9, 178.3253357410431, {'accuracy': 0.2401}, 20.416654936998384)
[2024-06-10 17:52:30,925][flwr][INFO] - configure_evaluate: no clients selected, skipping evaluation
[2024-06-10 17:52:30,925][flwr][INFO] - 
[2024-06-10 17:52:30,925][flwr][INFO] - [ROUND 10]
[2024-06-10 17:52:30,926][flwr][INFO] - configure_fit: strategy sampled 10 clients (out of 100)
[2024-06-10 17:52:31,872][flwr][INFO] - aggregate_fit: received 10 results and 0 failures
[2024-06-10 17:52:32,928][flwr][INFO] - fit progress: (10, 177.622416973114, {'accuracy': 0.2656}, 22.419741129000613)
[2024-06-10 17:52:32,928][flwr][INFO] - configure_evaluate: no clients selected, skipping evaluation
[2024-06-10 17:52:32,929][flwr][INFO] - 
[2024-06-10 17:52:32,929][flwr][INFO] - [SUMMARY]
[2024-06-10 17:52:32,929][flwr][INFO] - Run finished 10 rounds in 22.42s
[2024-06-10 17:52:32,929][flwr][INFO] - History (loss, centralized):
[2024-06-10 17:52:32,929][flwr][INFO] - 	('\tround 0: 182.1829071044922\n'
[2024-06-10 17:52:32,929][flwr][INFO] - 	 '\tround 1: 181.77241969108582\n'
[2024-06-10 17:52:32,929][flwr][INFO] - 	 '\tround 2: 181.3817048072815\n'
[2024-06-10 17:52:32,929][flwr][INFO] - 	 '\tround 3: 181.00767374038696\n'
[2024-06-10 17:52:32,929][flwr][INFO] - 	 '\tround 4: 180.63748693466187\n'
[2024-06-10 17:52:32,929][flwr][INFO] - 	 '\tround 5: 180.26483249664307\n'
[2024-06-10 17:52:32,929][flwr][INFO] - 	 '\tround 6: 179.86753463745117\n'
[2024-06-10 17:52:32,929][flwr][INFO] - 	 '\tround 7: 179.4246232509613\n'
[2024-06-10 17:52:32,929][flwr][INFO] - 	 '\tround 8: 178.9228160381317\n'
[2024-06-10 17:52:32,930][flwr][INFO] - 	 '\tround 9: 178.3253357410431\n'
[2024-06-10 17:52:32,930][flwr][INFO] - 	 '\tround 10: 177.622416973114\n')History (metrics, centralized):
[2024-06-10 17:52:32,930][flwr][INFO] - 	{'accuracy': [(0, 0.132),
[2024-06-10 17:52:32,930][flwr][INFO] - 	              (1, 0.1477),
[2024-06-10 17:52:32,930][flwr][INFO] - 	              (2, 0.1612),
[2024-06-10 17:52:32,930][flwr][INFO] - 	              (3, 0.1636),
[2024-06-10 17:52:32,930][flwr][INFO] - 	              (4, 0.173),
[2024-06-10 17:52:32,930][flwr][INFO] - 	              (5, 0.1887),
[2024-06-10 17:52:32,930][flwr][INFO] - 	              (6, 0.2069),
[2024-06-10 17:52:32,930][flwr][INFO] - 	              (7, 0.2217),
[2024-06-10 17:52:32,930][flwr][INFO] - 	              (8, 0.2312),
[2024-06-10 17:52:32,930][flwr][INFO] - 	              (9, 0.2401),
[2024-06-10 17:52:32,930][flwr][INFO] - 	              (10, 0.2656)]}
[2024-06-10 17:52:32,930][flwr][INFO] - 
