[2024-08-07 09:18:28,091][flwr][INFO] - Starting Flower simulation, config: num_rounds=6, no round_timeout
[2024-08-07 09:18:32,086][flwr][INFO] - Flower VCE: Ray initialized with resources: {'GPU': 1.0, 'accelerator_type:T4': 1.0, 'CPU': 8.0, 'memory': 72079414682.0, 'node:__internal_head__': 1.0, 'object_store_memory': 35176892006.0, 'node:10.50.9.88': 1.0}
[2024-08-07 09:18:32,087][flwr][INFO] - Optimize your simulation with Flower VCE: https://flower.ai/docs/framework/how-to-run-simulations.html
[2024-08-07 09:18:32,087][flwr][INFO] - Flower VCE: Resources for each Virtual Client: {'num_cpus': 3, 'num_gpus': 1.0}
[2024-08-07 09:18:32,106][flwr][INFO] - Flower VCE: Creating VirtualClientEngineActorPool with 1 actors
[2024-08-07 09:18:32,106][flwr][INFO] - [INIT]
[2024-08-07 09:18:32,106][flwr][INFO] - Requesting initial parameters from one random client
[2024-08-07 09:18:35,813][flwr][INFO] - Received initial parameters from one random client
[2024-08-07 09:18:35,813][flwr][INFO] - Evaluating initial global parameters
[2024-08-07 09:18:41,343][flwr][INFO] - initial parameters (loss, other metrics): 0.7288919786612192, OrderedDict([('all_iou', 0.03681761232606806), ('all_dice_liver', tensor(0.1261, dtype=torch.float64)), ('all_dice_tumour', tensor(0.0005, dtype=torch.float64))])
[2024-08-07 09:18:41,346][flwr][INFO] - 
[2024-08-07 09:18:41,346][flwr][INFO] - [ROUND 1]
[2024-08-07 09:18:41,347][flwr][INFO] - configure_fit: strategy sampled 1 clients (out of 1)
[2024-08-07 09:19:19,415][flwr][INFO] - aggregate_fit: received 1 results and 0 failures
[2024-08-07 09:19:19,495][flwr][WARNING] - No fit_metrics_aggregation_fn provided
[2024-08-07 09:19:20,571][flwr][INFO] - fit progress: (1, 0.5134053155779839, OrderedDict([('all_iou', 0.4644223632215021), ('all_dice_liver', tensor(0.2132, dtype=torch.float64)), ('all_dice_tumour', tensor(0.0005, dtype=torch.float64))]), 39.22476746700704)
[2024-08-07 09:19:20,573][flwr][INFO] - configure_evaluate: strategy sampled 1 clients (out of 1)
[2024-08-07 09:19:21,155][flwr][ERROR] - Traceback (most recent call last):
  File "/home/mmaia/my_envs/liver_torch/lib/python3.8/site-packages/flwr/simulation/ray_transport/ray_client_proxy.py", line 73, in _submit_job
    out_mssg, updated_context = self.actor_pool.get_client_result(
  File "/home/mmaia/my_envs/liver_torch/lib/python3.8/site-packages/flwr/simulation/ray_transport/ray_actor.py", line 399, in get_client_result
    return self._fetch_future_result(cid)
  File "/home/mmaia/my_envs/liver_torch/lib/python3.8/site-packages/flwr/simulation/ray_transport/ray_actor.py", line 280, in _fetch_future_result
    res_cid, out_mssg, updated_context = ray.get(
  File "/home/mmaia/my_envs/liver_torch/lib/python3.8/site-packages/ray/_private/auto_init_hook.py", line 21, in auto_init_wrapper
    return fn(*args, **kwargs)
  File "/home/mmaia/my_envs/liver_torch/lib/python3.8/site-packages/ray/_private/client_mode_hook.py", line 103, in wrapper
    return func(*args, **kwargs)
  File "/home/mmaia/my_envs/liver_torch/lib/python3.8/site-packages/ray/_private/worker.py", line 2667, in get
    values, debugger_breakpoint = worker.get_objects(object_refs, timeout=timeout)
  File "/home/mmaia/my_envs/liver_torch/lib/python3.8/site-packages/ray/_private/worker.py", line 864, in get_objects
    raise value.as_instanceof_cause()
ray.exceptions.RayTaskError(ClientAppException): [36mray::ClientAppActor.run()[39m (pid=1104563, ip=10.50.9.88, actor_id=27b2c71671ff2decc65a5b6601000000, repr=<flwr.simulation.ray_transport.ray_actor.ClientAppActor object at 0x7f7ed48fe640>)
  File "/home/mmaia/my_envs/liver_torch/lib/python3.8/site-packages/flwr/client/client_app.py", line 98, in __call__
    return self._call(message, context)
  File "/home/mmaia/my_envs/liver_torch/lib/python3.8/site-packages/flwr/client/client_app.py", line 81, in ffn
    out_message = handle_legacy_message_from_msgtype(
  File "/home/mmaia/my_envs/liver_torch/lib/python3.8/site-packages/flwr/client/message_handler/message_handler.py", line 141, in handle_legacy_message_from_msgtype
    out_recordset = evaluateres_to_recordset(evaluate_res)
  File "/home/mmaia/my_envs/liver_torch/lib/python3.8/site-packages/flwr/common/recordset_compat.py", line 301, in evaluateres_to_recordset
    recordset.configs_records[f"{res_str}.metrics"] = ConfigsRecord(
  File "/home/mmaia/my_envs/liver_torch/lib/python3.8/site-packages/flwr/common/record/configsrecord.py", line 85, in __init__
    self[k] = configs_dict[k]
  File "/home/mmaia/my_envs/liver_torch/lib/python3.8/site-packages/flwr/common/record/typeddict.py", line 38, in __setitem__
    self._check_value_fn(value)
  File "/home/mmaia/my_envs/liver_torch/lib/python3.8/site-packages/flwr/common/record/configsrecord.py", line 57, in _check_value
    is_valid(value)
  File "/home/mmaia/my_envs/liver_torch/lib/python3.8/site-packages/flwr/common/record/configsrecord.py", line 35, in is_valid
    raise TypeError(
TypeError: Not all values are of valid type. Expected `typing.Union[int, float, str, bytes, bool, typing.List[int], typing.List[float], typing.List[str], typing.List[bytes], typing.List[bool]]` but `<class 'torch.Tensor'>` was passed.

The above exception was the direct cause of the following exception:

[36mray::ClientAppActor.run()[39m (pid=1104563, ip=10.50.9.88, actor_id=27b2c71671ff2decc65a5b6601000000, repr=<flwr.simulation.ray_transport.ray_actor.ClientAppActor object at 0x7f7ed48fe640>)
  File "/home/mmaia/my_envs/liver_torch/lib/python3.8/site-packages/flwr/simulation/ray_transport/ray_actor.py", line 64, in run
    raise ClientAppException(str(ex)) from ex
flwr.client.client_app.ClientAppException: 
Exception ClientAppException occurred. Message: Not all values are of valid type. Expected `typing.Union[int, float, str, bytes, bool, typing.List[int], typing.List[float], typing.List[str], typing.List[bytes], typing.List[bool]]` but `<class 'torch.Tensor'>` was passed.

[2024-08-07 09:19:21,155][flwr][ERROR] - [36mray::ClientAppActor.run()[39m (pid=1104563, ip=10.50.9.88, actor_id=27b2c71671ff2decc65a5b6601000000, repr=<flwr.simulation.ray_transport.ray_actor.ClientAppActor object at 0x7f7ed48fe640>)
  File "/home/mmaia/my_envs/liver_torch/lib/python3.8/site-packages/flwr/client/client_app.py", line 98, in __call__
    return self._call(message, context)
  File "/home/mmaia/my_envs/liver_torch/lib/python3.8/site-packages/flwr/client/client_app.py", line 81, in ffn
    out_message = handle_legacy_message_from_msgtype(
  File "/home/mmaia/my_envs/liver_torch/lib/python3.8/site-packages/flwr/client/message_handler/message_handler.py", line 141, in handle_legacy_message_from_msgtype
    out_recordset = evaluateres_to_recordset(evaluate_res)
  File "/home/mmaia/my_envs/liver_torch/lib/python3.8/site-packages/flwr/common/recordset_compat.py", line 301, in evaluateres_to_recordset
    recordset.configs_records[f"{res_str}.metrics"] = ConfigsRecord(
  File "/home/mmaia/my_envs/liver_torch/lib/python3.8/site-packages/flwr/common/record/configsrecord.py", line 85, in __init__
    self[k] = configs_dict[k]
  File "/home/mmaia/my_envs/liver_torch/lib/python3.8/site-packages/flwr/common/record/typeddict.py", line 38, in __setitem__
    self._check_value_fn(value)
  File "/home/mmaia/my_envs/liver_torch/lib/python3.8/site-packages/flwr/common/record/configsrecord.py", line 57, in _check_value
    is_valid(value)
  File "/home/mmaia/my_envs/liver_torch/lib/python3.8/site-packages/flwr/common/record/configsrecord.py", line 35, in is_valid
    raise TypeError(
TypeError: Not all values are of valid type. Expected `typing.Union[int, float, str, bytes, bool, typing.List[int], typing.List[float], typing.List[str], typing.List[bytes], typing.List[bool]]` but `<class 'torch.Tensor'>` was passed.

The above exception was the direct cause of the following exception:

[36mray::ClientAppActor.run()[39m (pid=1104563, ip=10.50.9.88, actor_id=27b2c71671ff2decc65a5b6601000000, repr=<flwr.simulation.ray_transport.ray_actor.ClientAppActor object at 0x7f7ed48fe640>)
  File "/home/mmaia/my_envs/liver_torch/lib/python3.8/site-packages/flwr/simulation/ray_transport/ray_actor.py", line 64, in run
    raise ClientAppException(str(ex)) from ex
flwr.client.client_app.ClientAppException: 
Exception ClientAppException occurred. Message: Not all values are of valid type. Expected `typing.Union[int, float, str, bytes, bool, typing.List[int], typing.List[float], typing.List[str], typing.List[bytes], typing.List[bool]]` but `<class 'torch.Tensor'>` was passed.
[2024-08-07 09:19:21,156][flwr][INFO] - aggregate_evaluate: received 0 results and 1 failures
[2024-08-07 09:19:21,156][flwr][INFO] - 
[2024-08-07 09:19:21,156][flwr][INFO] - [ROUND 2]
[2024-08-07 09:19:21,156][flwr][INFO] - configure_fit: strategy sampled 1 clients (out of 1)
[2024-08-07 09:19:55,932][flwr][INFO] - aggregate_fit: received 1 results and 0 failures
[2024-08-07 09:19:57,110][flwr][INFO] - fit progress: (2, 0.4680697446068128, OrderedDict([('all_iou', 0.8215379230317509), ('all_dice_liver', tensor(0.2466, dtype=torch.float64)), ('all_dice_tumour', tensor(0.0004, dtype=torch.float64))]), 75.7634540181607)
[2024-08-07 09:19:57,112][flwr][INFO] - configure_evaluate: strategy sampled 1 clients (out of 1)
[2024-08-07 09:19:57,685][flwr][ERROR] - Traceback (most recent call last):
  File "/home/mmaia/my_envs/liver_torch/lib/python3.8/site-packages/flwr/simulation/ray_transport/ray_client_proxy.py", line 73, in _submit_job
    out_mssg, updated_context = self.actor_pool.get_client_result(
  File "/home/mmaia/my_envs/liver_torch/lib/python3.8/site-packages/flwr/simulation/ray_transport/ray_actor.py", line 399, in get_client_result
    return self._fetch_future_result(cid)
  File "/home/mmaia/my_envs/liver_torch/lib/python3.8/site-packages/flwr/simulation/ray_transport/ray_actor.py", line 280, in _fetch_future_result
    res_cid, out_mssg, updated_context = ray.get(
  File "/home/mmaia/my_envs/liver_torch/lib/python3.8/site-packages/ray/_private/auto_init_hook.py", line 21, in auto_init_wrapper
    return fn(*args, **kwargs)
  File "/home/mmaia/my_envs/liver_torch/lib/python3.8/site-packages/ray/_private/client_mode_hook.py", line 103, in wrapper
    return func(*args, **kwargs)
  File "/home/mmaia/my_envs/liver_torch/lib/python3.8/site-packages/ray/_private/worker.py", line 2667, in get
    values, debugger_breakpoint = worker.get_objects(object_refs, timeout=timeout)
  File "/home/mmaia/my_envs/liver_torch/lib/python3.8/site-packages/ray/_private/worker.py", line 864, in get_objects
    raise value.as_instanceof_cause()
ray.exceptions.RayTaskError(ClientAppException): [36mray::ClientAppActor.run()[39m (pid=1104563, ip=10.50.9.88, actor_id=27b2c71671ff2decc65a5b6601000000, repr=<flwr.simulation.ray_transport.ray_actor.ClientAppActor object at 0x7f7ed48fe640>)
  File "/home/mmaia/my_envs/liver_torch/lib/python3.8/site-packages/flwr/client/client_app.py", line 98, in __call__
    return self._call(message, context)
  File "/home/mmaia/my_envs/liver_torch/lib/python3.8/site-packages/flwr/client/client_app.py", line 81, in ffn
    out_message = handle_legacy_message_from_msgtype(
  File "/home/mmaia/my_envs/liver_torch/lib/python3.8/site-packages/flwr/client/message_handler/message_handler.py", line 141, in handle_legacy_message_from_msgtype
    out_recordset = evaluateres_to_recordset(evaluate_res)
  File "/home/mmaia/my_envs/liver_torch/lib/python3.8/site-packages/flwr/common/recordset_compat.py", line 301, in evaluateres_to_recordset
    recordset.configs_records[f"{res_str}.metrics"] = ConfigsRecord(
  File "/home/mmaia/my_envs/liver_torch/lib/python3.8/site-packages/flwr/common/record/configsrecord.py", line 85, in __init__
    self[k] = configs_dict[k]
  File "/home/mmaia/my_envs/liver_torch/lib/python3.8/site-packages/flwr/common/record/typeddict.py", line 38, in __setitem__
    self._check_value_fn(value)
  File "/home/mmaia/my_envs/liver_torch/lib/python3.8/site-packages/flwr/common/record/configsrecord.py", line 57, in _check_value
    is_valid(value)
  File "/home/mmaia/my_envs/liver_torch/lib/python3.8/site-packages/flwr/common/record/configsrecord.py", line 35, in is_valid
    raise TypeError(
TypeError: Not all values are of valid type. Expected `typing.Union[int, float, str, bytes, bool, typing.List[int], typing.List[float], typing.List[str], typing.List[bytes], typing.List[bool]]` but `<class 'torch.Tensor'>` was passed.

The above exception was the direct cause of the following exception:

[36mray::ClientAppActor.run()[39m (pid=1104563, ip=10.50.9.88, actor_id=27b2c71671ff2decc65a5b6601000000, repr=<flwr.simulation.ray_transport.ray_actor.ClientAppActor object at 0x7f7ed48fe640>)
  File "/home/mmaia/my_envs/liver_torch/lib/python3.8/site-packages/flwr/simulation/ray_transport/ray_actor.py", line 64, in run
    raise ClientAppException(str(ex)) from ex
flwr.client.client_app.ClientAppException: 
Exception ClientAppException occurred. Message: Not all values are of valid type. Expected `typing.Union[int, float, str, bytes, bool, typing.List[int], typing.List[float], typing.List[str], typing.List[bytes], typing.List[bool]]` but `<class 'torch.Tensor'>` was passed.

[2024-08-07 09:19:57,685][flwr][ERROR] - [36mray::ClientAppActor.run()[39m (pid=1104563, ip=10.50.9.88, actor_id=27b2c71671ff2decc65a5b6601000000, repr=<flwr.simulation.ray_transport.ray_actor.ClientAppActor object at 0x7f7ed48fe640>)
  File "/home/mmaia/my_envs/liver_torch/lib/python3.8/site-packages/flwr/client/client_app.py", line 98, in __call__
    return self._call(message, context)
  File "/home/mmaia/my_envs/liver_torch/lib/python3.8/site-packages/flwr/client/client_app.py", line 81, in ffn
    out_message = handle_legacy_message_from_msgtype(
  File "/home/mmaia/my_envs/liver_torch/lib/python3.8/site-packages/flwr/client/message_handler/message_handler.py", line 141, in handle_legacy_message_from_msgtype
    out_recordset = evaluateres_to_recordset(evaluate_res)
  File "/home/mmaia/my_envs/liver_torch/lib/python3.8/site-packages/flwr/common/recordset_compat.py", line 301, in evaluateres_to_recordset
    recordset.configs_records[f"{res_str}.metrics"] = ConfigsRecord(
  File "/home/mmaia/my_envs/liver_torch/lib/python3.8/site-packages/flwr/common/record/configsrecord.py", line 85, in __init__
    self[k] = configs_dict[k]
  File "/home/mmaia/my_envs/liver_torch/lib/python3.8/site-packages/flwr/common/record/typeddict.py", line 38, in __setitem__
    self._check_value_fn(value)
  File "/home/mmaia/my_envs/liver_torch/lib/python3.8/site-packages/flwr/common/record/configsrecord.py", line 57, in _check_value
    is_valid(value)
  File "/home/mmaia/my_envs/liver_torch/lib/python3.8/site-packages/flwr/common/record/configsrecord.py", line 35, in is_valid
    raise TypeError(
TypeError: Not all values are of valid type. Expected `typing.Union[int, float, str, bytes, bool, typing.List[int], typing.List[float], typing.List[str], typing.List[bytes], typing.List[bool]]` but `<class 'torch.Tensor'>` was passed.

The above exception was the direct cause of the following exception:

[36mray::ClientAppActor.run()[39m (pid=1104563, ip=10.50.9.88, actor_id=27b2c71671ff2decc65a5b6601000000, repr=<flwr.simulation.ray_transport.ray_actor.ClientAppActor object at 0x7f7ed48fe640>)
  File "/home/mmaia/my_envs/liver_torch/lib/python3.8/site-packages/flwr/simulation/ray_transport/ray_actor.py", line 64, in run
    raise ClientAppException(str(ex)) from ex
flwr.client.client_app.ClientAppException: 
Exception ClientAppException occurred. Message: Not all values are of valid type. Expected `typing.Union[int, float, str, bytes, bool, typing.List[int], typing.List[float], typing.List[str], typing.List[bytes], typing.List[bool]]` but `<class 'torch.Tensor'>` was passed.
[2024-08-07 09:19:57,686][flwr][INFO] - aggregate_evaluate: received 0 results and 1 failures
[2024-08-07 09:19:57,686][flwr][INFO] - 
[2024-08-07 09:19:57,686][flwr][INFO] - [ROUND 3]
[2024-08-07 09:19:57,686][flwr][INFO] - configure_fit: strategy sampled 1 clients (out of 1)
[2024-08-07 09:20:33,501][flwr][INFO] - aggregate_fit: received 1 results and 0 failures
[2024-08-07 09:20:34,698][flwr][INFO] - fit progress: (3, 0.4471299077073733, OrderedDict([('all_iou', 0.8423317316941917), ('all_dice_liver', tensor(0.2342, dtype=torch.float64)), ('all_dice_tumour', tensor(0.0004, dtype=torch.float64))]), 113.35168914403766)
[2024-08-07 09:20:34,700][flwr][INFO] - configure_evaluate: strategy sampled 1 clients (out of 1)
[2024-08-07 09:20:35,264][flwr][ERROR] - Traceback (most recent call last):
  File "/home/mmaia/my_envs/liver_torch/lib/python3.8/site-packages/flwr/simulation/ray_transport/ray_client_proxy.py", line 73, in _submit_job
    out_mssg, updated_context = self.actor_pool.get_client_result(
  File "/home/mmaia/my_envs/liver_torch/lib/python3.8/site-packages/flwr/simulation/ray_transport/ray_actor.py", line 399, in get_client_result
    return self._fetch_future_result(cid)
  File "/home/mmaia/my_envs/liver_torch/lib/python3.8/site-packages/flwr/simulation/ray_transport/ray_actor.py", line 280, in _fetch_future_result
    res_cid, out_mssg, updated_context = ray.get(
  File "/home/mmaia/my_envs/liver_torch/lib/python3.8/site-packages/ray/_private/auto_init_hook.py", line 21, in auto_init_wrapper
    return fn(*args, **kwargs)
  File "/home/mmaia/my_envs/liver_torch/lib/python3.8/site-packages/ray/_private/client_mode_hook.py", line 103, in wrapper
    return func(*args, **kwargs)
  File "/home/mmaia/my_envs/liver_torch/lib/python3.8/site-packages/ray/_private/worker.py", line 2667, in get
    values, debugger_breakpoint = worker.get_objects(object_refs, timeout=timeout)
  File "/home/mmaia/my_envs/liver_torch/lib/python3.8/site-packages/ray/_private/worker.py", line 864, in get_objects
    raise value.as_instanceof_cause()
ray.exceptions.RayTaskError(ClientAppException): [36mray::ClientAppActor.run()[39m (pid=1104563, ip=10.50.9.88, actor_id=27b2c71671ff2decc65a5b6601000000, repr=<flwr.simulation.ray_transport.ray_actor.ClientAppActor object at 0x7f7ed48fe640>)
  File "/home/mmaia/my_envs/liver_torch/lib/python3.8/site-packages/flwr/client/client_app.py", line 98, in __call__
    return self._call(message, context)
  File "/home/mmaia/my_envs/liver_torch/lib/python3.8/site-packages/flwr/client/client_app.py", line 81, in ffn
    out_message = handle_legacy_message_from_msgtype(
  File "/home/mmaia/my_envs/liver_torch/lib/python3.8/site-packages/flwr/client/message_handler/message_handler.py", line 141, in handle_legacy_message_from_msgtype
    out_recordset = evaluateres_to_recordset(evaluate_res)
  File "/home/mmaia/my_envs/liver_torch/lib/python3.8/site-packages/flwr/common/recordset_compat.py", line 301, in evaluateres_to_recordset
    recordset.configs_records[f"{res_str}.metrics"] = ConfigsRecord(
  File "/home/mmaia/my_envs/liver_torch/lib/python3.8/site-packages/flwr/common/record/configsrecord.py", line 85, in __init__
    self[k] = configs_dict[k]
  File "/home/mmaia/my_envs/liver_torch/lib/python3.8/site-packages/flwr/common/record/typeddict.py", line 38, in __setitem__
    self._check_value_fn(value)
  File "/home/mmaia/my_envs/liver_torch/lib/python3.8/site-packages/flwr/common/record/configsrecord.py", line 57, in _check_value
    is_valid(value)
  File "/home/mmaia/my_envs/liver_torch/lib/python3.8/site-packages/flwr/common/record/configsrecord.py", line 35, in is_valid
    raise TypeError(
TypeError: Not all values are of valid type. Expected `typing.Union[int, float, str, bytes, bool, typing.List[int], typing.List[float], typing.List[str], typing.List[bytes], typing.List[bool]]` but `<class 'torch.Tensor'>` was passed.

The above exception was the direct cause of the following exception:

[36mray::ClientAppActor.run()[39m (pid=1104563, ip=10.50.9.88, actor_id=27b2c71671ff2decc65a5b6601000000, repr=<flwr.simulation.ray_transport.ray_actor.ClientAppActor object at 0x7f7ed48fe640>)
  File "/home/mmaia/my_envs/liver_torch/lib/python3.8/site-packages/flwr/simulation/ray_transport/ray_actor.py", line 64, in run
    raise ClientAppException(str(ex)) from ex
flwr.client.client_app.ClientAppException: 
Exception ClientAppException occurred. Message: Not all values are of valid type. Expected `typing.Union[int, float, str, bytes, bool, typing.List[int], typing.List[float], typing.List[str], typing.List[bytes], typing.List[bool]]` but `<class 'torch.Tensor'>` was passed.

[2024-08-07 09:20:35,264][flwr][ERROR] - [36mray::ClientAppActor.run()[39m (pid=1104563, ip=10.50.9.88, actor_id=27b2c71671ff2decc65a5b6601000000, repr=<flwr.simulation.ray_transport.ray_actor.ClientAppActor object at 0x7f7ed48fe640>)
  File "/home/mmaia/my_envs/liver_torch/lib/python3.8/site-packages/flwr/client/client_app.py", line 98, in __call__
    return self._call(message, context)
  File "/home/mmaia/my_envs/liver_torch/lib/python3.8/site-packages/flwr/client/client_app.py", line 81, in ffn
    out_message = handle_legacy_message_from_msgtype(
  File "/home/mmaia/my_envs/liver_torch/lib/python3.8/site-packages/flwr/client/message_handler/message_handler.py", line 141, in handle_legacy_message_from_msgtype
    out_recordset = evaluateres_to_recordset(evaluate_res)
  File "/home/mmaia/my_envs/liver_torch/lib/python3.8/site-packages/flwr/common/recordset_compat.py", line 301, in evaluateres_to_recordset
    recordset.configs_records[f"{res_str}.metrics"] = ConfigsRecord(
  File "/home/mmaia/my_envs/liver_torch/lib/python3.8/site-packages/flwr/common/record/configsrecord.py", line 85, in __init__
    self[k] = configs_dict[k]
  File "/home/mmaia/my_envs/liver_torch/lib/python3.8/site-packages/flwr/common/record/typeddict.py", line 38, in __setitem__
    self._check_value_fn(value)
  File "/home/mmaia/my_envs/liver_torch/lib/python3.8/site-packages/flwr/common/record/configsrecord.py", line 57, in _check_value
    is_valid(value)
  File "/home/mmaia/my_envs/liver_torch/lib/python3.8/site-packages/flwr/common/record/configsrecord.py", line 35, in is_valid
    raise TypeError(
TypeError: Not all values are of valid type. Expected `typing.Union[int, float, str, bytes, bool, typing.List[int], typing.List[float], typing.List[str], typing.List[bytes], typing.List[bool]]` but `<class 'torch.Tensor'>` was passed.

The above exception was the direct cause of the following exception:

[36mray::ClientAppActor.run()[39m (pid=1104563, ip=10.50.9.88, actor_id=27b2c71671ff2decc65a5b6601000000, repr=<flwr.simulation.ray_transport.ray_actor.ClientAppActor object at 0x7f7ed48fe640>)
  File "/home/mmaia/my_envs/liver_torch/lib/python3.8/site-packages/flwr/simulation/ray_transport/ray_actor.py", line 64, in run
    raise ClientAppException(str(ex)) from ex
flwr.client.client_app.ClientAppException: 
Exception ClientAppException occurred. Message: Not all values are of valid type. Expected `typing.Union[int, float, str, bytes, bool, typing.List[int], typing.List[float], typing.List[str], typing.List[bytes], typing.List[bool]]` but `<class 'torch.Tensor'>` was passed.
[2024-08-07 09:20:35,264][flwr][INFO] - aggregate_evaluate: received 0 results and 1 failures
[2024-08-07 09:20:35,264][flwr][INFO] - 
[2024-08-07 09:20:35,264][flwr][INFO] - [ROUND 4]
[2024-08-07 09:20:35,265][flwr][INFO] - configure_fit: strategy sampled 1 clients (out of 1)
[2024-08-07 09:21:12,198][flwr][INFO] - aggregate_fit: received 1 results and 0 failures
[2024-08-07 09:21:13,437][flwr][INFO] - fit progress: (4, 0.4267723460992177, OrderedDict([('all_iou', 0.827601091186032), ('all_dice_liver', tensor(0.2524, dtype=torch.float64)), ('all_dice_tumour', tensor(0.0003, dtype=torch.float64))]), 152.09034110885113)
[2024-08-07 09:21:13,439][flwr][INFO] - configure_evaluate: strategy sampled 1 clients (out of 1)
[2024-08-07 09:21:14,036][flwr][ERROR] - Traceback (most recent call last):
  File "/home/mmaia/my_envs/liver_torch/lib/python3.8/site-packages/flwr/simulation/ray_transport/ray_client_proxy.py", line 73, in _submit_job
    out_mssg, updated_context = self.actor_pool.get_client_result(
  File "/home/mmaia/my_envs/liver_torch/lib/python3.8/site-packages/flwr/simulation/ray_transport/ray_actor.py", line 399, in get_client_result
    return self._fetch_future_result(cid)
  File "/home/mmaia/my_envs/liver_torch/lib/python3.8/site-packages/flwr/simulation/ray_transport/ray_actor.py", line 280, in _fetch_future_result
    res_cid, out_mssg, updated_context = ray.get(
  File "/home/mmaia/my_envs/liver_torch/lib/python3.8/site-packages/ray/_private/auto_init_hook.py", line 21, in auto_init_wrapper
    return fn(*args, **kwargs)
  File "/home/mmaia/my_envs/liver_torch/lib/python3.8/site-packages/ray/_private/client_mode_hook.py", line 103, in wrapper
    return func(*args, **kwargs)
  File "/home/mmaia/my_envs/liver_torch/lib/python3.8/site-packages/ray/_private/worker.py", line 2667, in get
    values, debugger_breakpoint = worker.get_objects(object_refs, timeout=timeout)
  File "/home/mmaia/my_envs/liver_torch/lib/python3.8/site-packages/ray/_private/worker.py", line 864, in get_objects
    raise value.as_instanceof_cause()
ray.exceptions.RayTaskError(ClientAppException): [36mray::ClientAppActor.run()[39m (pid=1104563, ip=10.50.9.88, actor_id=27b2c71671ff2decc65a5b6601000000, repr=<flwr.simulation.ray_transport.ray_actor.ClientAppActor object at 0x7f7ed48fe640>)
  File "/home/mmaia/my_envs/liver_torch/lib/python3.8/site-packages/flwr/client/client_app.py", line 98, in __call__
    return self._call(message, context)
  File "/home/mmaia/my_envs/liver_torch/lib/python3.8/site-packages/flwr/client/client_app.py", line 81, in ffn
    out_message = handle_legacy_message_from_msgtype(
  File "/home/mmaia/my_envs/liver_torch/lib/python3.8/site-packages/flwr/client/message_handler/message_handler.py", line 141, in handle_legacy_message_from_msgtype
    out_recordset = evaluateres_to_recordset(evaluate_res)
  File "/home/mmaia/my_envs/liver_torch/lib/python3.8/site-packages/flwr/common/recordset_compat.py", line 301, in evaluateres_to_recordset
    recordset.configs_records[f"{res_str}.metrics"] = ConfigsRecord(
  File "/home/mmaia/my_envs/liver_torch/lib/python3.8/site-packages/flwr/common/record/configsrecord.py", line 85, in __init__
    self[k] = configs_dict[k]
  File "/home/mmaia/my_envs/liver_torch/lib/python3.8/site-packages/flwr/common/record/typeddict.py", line 38, in __setitem__
    self._check_value_fn(value)
  File "/home/mmaia/my_envs/liver_torch/lib/python3.8/site-packages/flwr/common/record/configsrecord.py", line 57, in _check_value
    is_valid(value)
  File "/home/mmaia/my_envs/liver_torch/lib/python3.8/site-packages/flwr/common/record/configsrecord.py", line 35, in is_valid
    raise TypeError(
TypeError: Not all values are of valid type. Expected `typing.Union[int, float, str, bytes, bool, typing.List[int], typing.List[float], typing.List[str], typing.List[bytes], typing.List[bool]]` but `<class 'torch.Tensor'>` was passed.

The above exception was the direct cause of the following exception:

[36mray::ClientAppActor.run()[39m (pid=1104563, ip=10.50.9.88, actor_id=27b2c71671ff2decc65a5b6601000000, repr=<flwr.simulation.ray_transport.ray_actor.ClientAppActor object at 0x7f7ed48fe640>)
  File "/home/mmaia/my_envs/liver_torch/lib/python3.8/site-packages/flwr/simulation/ray_transport/ray_actor.py", line 64, in run
    raise ClientAppException(str(ex)) from ex
flwr.client.client_app.ClientAppException: 
Exception ClientAppException occurred. Message: Not all values are of valid type. Expected `typing.Union[int, float, str, bytes, bool, typing.List[int], typing.List[float], typing.List[str], typing.List[bytes], typing.List[bool]]` but `<class 'torch.Tensor'>` was passed.

[2024-08-07 09:21:14,036][flwr][ERROR] - [36mray::ClientAppActor.run()[39m (pid=1104563, ip=10.50.9.88, actor_id=27b2c71671ff2decc65a5b6601000000, repr=<flwr.simulation.ray_transport.ray_actor.ClientAppActor object at 0x7f7ed48fe640>)
  File "/home/mmaia/my_envs/liver_torch/lib/python3.8/site-packages/flwr/client/client_app.py", line 98, in __call__
    return self._call(message, context)
  File "/home/mmaia/my_envs/liver_torch/lib/python3.8/site-packages/flwr/client/client_app.py", line 81, in ffn
    out_message = handle_legacy_message_from_msgtype(
  File "/home/mmaia/my_envs/liver_torch/lib/python3.8/site-packages/flwr/client/message_handler/message_handler.py", line 141, in handle_legacy_message_from_msgtype
    out_recordset = evaluateres_to_recordset(evaluate_res)
  File "/home/mmaia/my_envs/liver_torch/lib/python3.8/site-packages/flwr/common/recordset_compat.py", line 301, in evaluateres_to_recordset
    recordset.configs_records[f"{res_str}.metrics"] = ConfigsRecord(
  File "/home/mmaia/my_envs/liver_torch/lib/python3.8/site-packages/flwr/common/record/configsrecord.py", line 85, in __init__
    self[k] = configs_dict[k]
  File "/home/mmaia/my_envs/liver_torch/lib/python3.8/site-packages/flwr/common/record/typeddict.py", line 38, in __setitem__
    self._check_value_fn(value)
  File "/home/mmaia/my_envs/liver_torch/lib/python3.8/site-packages/flwr/common/record/configsrecord.py", line 57, in _check_value
    is_valid(value)
  File "/home/mmaia/my_envs/liver_torch/lib/python3.8/site-packages/flwr/common/record/configsrecord.py", line 35, in is_valid
    raise TypeError(
TypeError: Not all values are of valid type. Expected `typing.Union[int, float, str, bytes, bool, typing.List[int], typing.List[float], typing.List[str], typing.List[bytes], typing.List[bool]]` but `<class 'torch.Tensor'>` was passed.

The above exception was the direct cause of the following exception:

[36mray::ClientAppActor.run()[39m (pid=1104563, ip=10.50.9.88, actor_id=27b2c71671ff2decc65a5b6601000000, repr=<flwr.simulation.ray_transport.ray_actor.ClientAppActor object at 0x7f7ed48fe640>)
  File "/home/mmaia/my_envs/liver_torch/lib/python3.8/site-packages/flwr/simulation/ray_transport/ray_actor.py", line 64, in run
    raise ClientAppException(str(ex)) from ex
flwr.client.client_app.ClientAppException: 
Exception ClientAppException occurred. Message: Not all values are of valid type. Expected `typing.Union[int, float, str, bytes, bool, typing.List[int], typing.List[float], typing.List[str], typing.List[bytes], typing.List[bool]]` but `<class 'torch.Tensor'>` was passed.
[2024-08-07 09:21:14,037][flwr][INFO] - aggregate_evaluate: received 0 results and 1 failures
[2024-08-07 09:21:14,037][flwr][INFO] - 
[2024-08-07 09:21:14,037][flwr][INFO] - [ROUND 5]
[2024-08-07 09:21:14,037][flwr][INFO] - configure_fit: strategy sampled 1 clients (out of 1)
[2024-08-07 09:21:51,142][flwr][INFO] - aggregate_fit: received 1 results and 0 failures
[2024-08-07 09:21:52,394][flwr][INFO] - fit progress: (5, 0.40600505967934925, OrderedDict([('all_iou', 0.8808610053412292), ('all_dice_liver', tensor(0.2540, dtype=torch.float64)), ('all_dice_tumour', tensor(0.0004, dtype=torch.float64))]), 191.04809392802417)
[2024-08-07 09:21:52,397][flwr][INFO] - configure_evaluate: strategy sampled 1 clients (out of 1)
[2024-08-07 09:21:52,994][flwr][ERROR] - Traceback (most recent call last):
  File "/home/mmaia/my_envs/liver_torch/lib/python3.8/site-packages/flwr/simulation/ray_transport/ray_client_proxy.py", line 73, in _submit_job
    out_mssg, updated_context = self.actor_pool.get_client_result(
  File "/home/mmaia/my_envs/liver_torch/lib/python3.8/site-packages/flwr/simulation/ray_transport/ray_actor.py", line 399, in get_client_result
    return self._fetch_future_result(cid)
  File "/home/mmaia/my_envs/liver_torch/lib/python3.8/site-packages/flwr/simulation/ray_transport/ray_actor.py", line 280, in _fetch_future_result
    res_cid, out_mssg, updated_context = ray.get(
  File "/home/mmaia/my_envs/liver_torch/lib/python3.8/site-packages/ray/_private/auto_init_hook.py", line 21, in auto_init_wrapper
    return fn(*args, **kwargs)
  File "/home/mmaia/my_envs/liver_torch/lib/python3.8/site-packages/ray/_private/client_mode_hook.py", line 103, in wrapper
    return func(*args, **kwargs)
  File "/home/mmaia/my_envs/liver_torch/lib/python3.8/site-packages/ray/_private/worker.py", line 2667, in get
    values, debugger_breakpoint = worker.get_objects(object_refs, timeout=timeout)
  File "/home/mmaia/my_envs/liver_torch/lib/python3.8/site-packages/ray/_private/worker.py", line 864, in get_objects
    raise value.as_instanceof_cause()
ray.exceptions.RayTaskError(ClientAppException): [36mray::ClientAppActor.run()[39m (pid=1104563, ip=10.50.9.88, actor_id=27b2c71671ff2decc65a5b6601000000, repr=<flwr.simulation.ray_transport.ray_actor.ClientAppActor object at 0x7f7ed48fe640>)
  File "/home/mmaia/my_envs/liver_torch/lib/python3.8/site-packages/flwr/client/client_app.py", line 98, in __call__
    return self._call(message, context)
  File "/home/mmaia/my_envs/liver_torch/lib/python3.8/site-packages/flwr/client/client_app.py", line 81, in ffn
    out_message = handle_legacy_message_from_msgtype(
  File "/home/mmaia/my_envs/liver_torch/lib/python3.8/site-packages/flwr/client/message_handler/message_handler.py", line 141, in handle_legacy_message_from_msgtype
    out_recordset = evaluateres_to_recordset(evaluate_res)
  File "/home/mmaia/my_envs/liver_torch/lib/python3.8/site-packages/flwr/common/recordset_compat.py", line 301, in evaluateres_to_recordset
    recordset.configs_records[f"{res_str}.metrics"] = ConfigsRecord(
  File "/home/mmaia/my_envs/liver_torch/lib/python3.8/site-packages/flwr/common/record/configsrecord.py", line 85, in __init__
    self[k] = configs_dict[k]
  File "/home/mmaia/my_envs/liver_torch/lib/python3.8/site-packages/flwr/common/record/typeddict.py", line 38, in __setitem__
    self._check_value_fn(value)
  File "/home/mmaia/my_envs/liver_torch/lib/python3.8/site-packages/flwr/common/record/configsrecord.py", line 57, in _check_value
    is_valid(value)
  File "/home/mmaia/my_envs/liver_torch/lib/python3.8/site-packages/flwr/common/record/configsrecord.py", line 35, in is_valid
    raise TypeError(
TypeError: Not all values are of valid type. Expected `typing.Union[int, float, str, bytes, bool, typing.List[int], typing.List[float], typing.List[str], typing.List[bytes], typing.List[bool]]` but `<class 'torch.Tensor'>` was passed.

The above exception was the direct cause of the following exception:

[36mray::ClientAppActor.run()[39m (pid=1104563, ip=10.50.9.88, actor_id=27b2c71671ff2decc65a5b6601000000, repr=<flwr.simulation.ray_transport.ray_actor.ClientAppActor object at 0x7f7ed48fe640>)
  File "/home/mmaia/my_envs/liver_torch/lib/python3.8/site-packages/flwr/simulation/ray_transport/ray_actor.py", line 64, in run
    raise ClientAppException(str(ex)) from ex
flwr.client.client_app.ClientAppException: 
Exception ClientAppException occurred. Message: Not all values are of valid type. Expected `typing.Union[int, float, str, bytes, bool, typing.List[int], typing.List[float], typing.List[str], typing.List[bytes], typing.List[bool]]` but `<class 'torch.Tensor'>` was passed.

[2024-08-07 09:21:52,994][flwr][ERROR] - [36mray::ClientAppActor.run()[39m (pid=1104563, ip=10.50.9.88, actor_id=27b2c71671ff2decc65a5b6601000000, repr=<flwr.simulation.ray_transport.ray_actor.ClientAppActor object at 0x7f7ed48fe640>)
  File "/home/mmaia/my_envs/liver_torch/lib/python3.8/site-packages/flwr/client/client_app.py", line 98, in __call__
    return self._call(message, context)
  File "/home/mmaia/my_envs/liver_torch/lib/python3.8/site-packages/flwr/client/client_app.py", line 81, in ffn
    out_message = handle_legacy_message_from_msgtype(
  File "/home/mmaia/my_envs/liver_torch/lib/python3.8/site-packages/flwr/client/message_handler/message_handler.py", line 141, in handle_legacy_message_from_msgtype
    out_recordset = evaluateres_to_recordset(evaluate_res)
  File "/home/mmaia/my_envs/liver_torch/lib/python3.8/site-packages/flwr/common/recordset_compat.py", line 301, in evaluateres_to_recordset
    recordset.configs_records[f"{res_str}.metrics"] = ConfigsRecord(
  File "/home/mmaia/my_envs/liver_torch/lib/python3.8/site-packages/flwr/common/record/configsrecord.py", line 85, in __init__
    self[k] = configs_dict[k]
  File "/home/mmaia/my_envs/liver_torch/lib/python3.8/site-packages/flwr/common/record/typeddict.py", line 38, in __setitem__
    self._check_value_fn(value)
  File "/home/mmaia/my_envs/liver_torch/lib/python3.8/site-packages/flwr/common/record/configsrecord.py", line 57, in _check_value
    is_valid(value)
  File "/home/mmaia/my_envs/liver_torch/lib/python3.8/site-packages/flwr/common/record/configsrecord.py", line 35, in is_valid
    raise TypeError(
TypeError: Not all values are of valid type. Expected `typing.Union[int, float, str, bytes, bool, typing.List[int], typing.List[float], typing.List[str], typing.List[bytes], typing.List[bool]]` but `<class 'torch.Tensor'>` was passed.

The above exception was the direct cause of the following exception:

[36mray::ClientAppActor.run()[39m (pid=1104563, ip=10.50.9.88, actor_id=27b2c71671ff2decc65a5b6601000000, repr=<flwr.simulation.ray_transport.ray_actor.ClientAppActor object at 0x7f7ed48fe640>)
  File "/home/mmaia/my_envs/liver_torch/lib/python3.8/site-packages/flwr/simulation/ray_transport/ray_actor.py", line 64, in run
    raise ClientAppException(str(ex)) from ex
flwr.client.client_app.ClientAppException: 
Exception ClientAppException occurred. Message: Not all values are of valid type. Expected `typing.Union[int, float, str, bytes, bool, typing.List[int], typing.List[float], typing.List[str], typing.List[bytes], typing.List[bool]]` but `<class 'torch.Tensor'>` was passed.
[2024-08-07 09:21:52,994][flwr][INFO] - aggregate_evaluate: received 0 results and 1 failures
[2024-08-07 09:21:52,994][flwr][INFO] - 
[2024-08-07 09:21:52,994][flwr][INFO] - [ROUND 6]
[2024-08-07 09:21:52,995][flwr][INFO] - configure_fit: strategy sampled 1 clients (out of 1)
[2024-08-07 09:22:30,019][flwr][INFO] - aggregate_fit: received 1 results and 0 failures
[2024-08-07 09:22:31,213][flwr][INFO] - fit progress: (6, 0.3859519263108571, OrderedDict([('all_iou', 0.833554796896432), ('all_dice_liver', tensor(0.2742, dtype=torch.float64)), ('all_dice_tumour', tensor(0.0003, dtype=torch.float64))]), 229.86697736103088)
[2024-08-07 09:22:31,216][flwr][INFO] - configure_evaluate: strategy sampled 1 clients (out of 1)
[2024-08-07 09:22:31,815][flwr][ERROR] - Traceback (most recent call last):
  File "/home/mmaia/my_envs/liver_torch/lib/python3.8/site-packages/flwr/simulation/ray_transport/ray_client_proxy.py", line 73, in _submit_job
    out_mssg, updated_context = self.actor_pool.get_client_result(
  File "/home/mmaia/my_envs/liver_torch/lib/python3.8/site-packages/flwr/simulation/ray_transport/ray_actor.py", line 399, in get_client_result
    return self._fetch_future_result(cid)
  File "/home/mmaia/my_envs/liver_torch/lib/python3.8/site-packages/flwr/simulation/ray_transport/ray_actor.py", line 280, in _fetch_future_result
    res_cid, out_mssg, updated_context = ray.get(
  File "/home/mmaia/my_envs/liver_torch/lib/python3.8/site-packages/ray/_private/auto_init_hook.py", line 21, in auto_init_wrapper
    return fn(*args, **kwargs)
  File "/home/mmaia/my_envs/liver_torch/lib/python3.8/site-packages/ray/_private/client_mode_hook.py", line 103, in wrapper
    return func(*args, **kwargs)
  File "/home/mmaia/my_envs/liver_torch/lib/python3.8/site-packages/ray/_private/worker.py", line 2667, in get
    values, debugger_breakpoint = worker.get_objects(object_refs, timeout=timeout)
  File "/home/mmaia/my_envs/liver_torch/lib/python3.8/site-packages/ray/_private/worker.py", line 864, in get_objects
    raise value.as_instanceof_cause()
ray.exceptions.RayTaskError(ClientAppException): [36mray::ClientAppActor.run()[39m (pid=1104563, ip=10.50.9.88, actor_id=27b2c71671ff2decc65a5b6601000000, repr=<flwr.simulation.ray_transport.ray_actor.ClientAppActor object at 0x7f7ed48fe640>)
  File "/home/mmaia/my_envs/liver_torch/lib/python3.8/site-packages/flwr/client/client_app.py", line 98, in __call__
    return self._call(message, context)
  File "/home/mmaia/my_envs/liver_torch/lib/python3.8/site-packages/flwr/client/client_app.py", line 81, in ffn
    out_message = handle_legacy_message_from_msgtype(
  File "/home/mmaia/my_envs/liver_torch/lib/python3.8/site-packages/flwr/client/message_handler/message_handler.py", line 141, in handle_legacy_message_from_msgtype
    out_recordset = evaluateres_to_recordset(evaluate_res)
  File "/home/mmaia/my_envs/liver_torch/lib/python3.8/site-packages/flwr/common/recordset_compat.py", line 301, in evaluateres_to_recordset
    recordset.configs_records[f"{res_str}.metrics"] = ConfigsRecord(
  File "/home/mmaia/my_envs/liver_torch/lib/python3.8/site-packages/flwr/common/record/configsrecord.py", line 85, in __init__
    self[k] = configs_dict[k]
  File "/home/mmaia/my_envs/liver_torch/lib/python3.8/site-packages/flwr/common/record/typeddict.py", line 38, in __setitem__
    self._check_value_fn(value)
  File "/home/mmaia/my_envs/liver_torch/lib/python3.8/site-packages/flwr/common/record/configsrecord.py", line 57, in _check_value
    is_valid(value)
  File "/home/mmaia/my_envs/liver_torch/lib/python3.8/site-packages/flwr/common/record/configsrecord.py", line 35, in is_valid
    raise TypeError(
TypeError: Not all values are of valid type. Expected `typing.Union[int, float, str, bytes, bool, typing.List[int], typing.List[float], typing.List[str], typing.List[bytes], typing.List[bool]]` but `<class 'torch.Tensor'>` was passed.

The above exception was the direct cause of the following exception:

[36mray::ClientAppActor.run()[39m (pid=1104563, ip=10.50.9.88, actor_id=27b2c71671ff2decc65a5b6601000000, repr=<flwr.simulation.ray_transport.ray_actor.ClientAppActor object at 0x7f7ed48fe640>)
  File "/home/mmaia/my_envs/liver_torch/lib/python3.8/site-packages/flwr/simulation/ray_transport/ray_actor.py", line 64, in run
    raise ClientAppException(str(ex)) from ex
flwr.client.client_app.ClientAppException: 
Exception ClientAppException occurred. Message: Not all values are of valid type. Expected `typing.Union[int, float, str, bytes, bool, typing.List[int], typing.List[float], typing.List[str], typing.List[bytes], typing.List[bool]]` but `<class 'torch.Tensor'>` was passed.

[2024-08-07 09:22:31,815][flwr][ERROR] - [36mray::ClientAppActor.run()[39m (pid=1104563, ip=10.50.9.88, actor_id=27b2c71671ff2decc65a5b6601000000, repr=<flwr.simulation.ray_transport.ray_actor.ClientAppActor object at 0x7f7ed48fe640>)
  File "/home/mmaia/my_envs/liver_torch/lib/python3.8/site-packages/flwr/client/client_app.py", line 98, in __call__
    return self._call(message, context)
  File "/home/mmaia/my_envs/liver_torch/lib/python3.8/site-packages/flwr/client/client_app.py", line 81, in ffn
    out_message = handle_legacy_message_from_msgtype(
  File "/home/mmaia/my_envs/liver_torch/lib/python3.8/site-packages/flwr/client/message_handler/message_handler.py", line 141, in handle_legacy_message_from_msgtype
    out_recordset = evaluateres_to_recordset(evaluate_res)
  File "/home/mmaia/my_envs/liver_torch/lib/python3.8/site-packages/flwr/common/recordset_compat.py", line 301, in evaluateres_to_recordset
    recordset.configs_records[f"{res_str}.metrics"] = ConfigsRecord(
  File "/home/mmaia/my_envs/liver_torch/lib/python3.8/site-packages/flwr/common/record/configsrecord.py", line 85, in __init__
    self[k] = configs_dict[k]
  File "/home/mmaia/my_envs/liver_torch/lib/python3.8/site-packages/flwr/common/record/typeddict.py", line 38, in __setitem__
    self._check_value_fn(value)
  File "/home/mmaia/my_envs/liver_torch/lib/python3.8/site-packages/flwr/common/record/configsrecord.py", line 57, in _check_value
    is_valid(value)
  File "/home/mmaia/my_envs/liver_torch/lib/python3.8/site-packages/flwr/common/record/configsrecord.py", line 35, in is_valid
    raise TypeError(
TypeError: Not all values are of valid type. Expected `typing.Union[int, float, str, bytes, bool, typing.List[int], typing.List[float], typing.List[str], typing.List[bytes], typing.List[bool]]` but `<class 'torch.Tensor'>` was passed.

The above exception was the direct cause of the following exception:

[36mray::ClientAppActor.run()[39m (pid=1104563, ip=10.50.9.88, actor_id=27b2c71671ff2decc65a5b6601000000, repr=<flwr.simulation.ray_transport.ray_actor.ClientAppActor object at 0x7f7ed48fe640>)
  File "/home/mmaia/my_envs/liver_torch/lib/python3.8/site-packages/flwr/simulation/ray_transport/ray_actor.py", line 64, in run
    raise ClientAppException(str(ex)) from ex
flwr.client.client_app.ClientAppException: 
Exception ClientAppException occurred. Message: Not all values are of valid type. Expected `typing.Union[int, float, str, bytes, bool, typing.List[int], typing.List[float], typing.List[str], typing.List[bytes], typing.List[bool]]` but `<class 'torch.Tensor'>` was passed.
[2024-08-07 09:22:31,815][flwr][INFO] - aggregate_evaluate: received 0 results and 1 failures
[2024-08-07 09:22:31,816][flwr][INFO] - 
[2024-08-07 09:22:31,816][flwr][INFO] - [SUMMARY]
[2024-08-07 09:22:31,816][flwr][INFO] - Run finished 6 round(s) in 230.47s
[2024-08-07 09:22:31,827][flwr][INFO] - 	History (loss, centralized):
[2024-08-07 09:22:31,827][flwr][INFO] - 		round 0: 0.7288919786612192
[2024-08-07 09:22:31,827][flwr][INFO] - 		round 1: 0.5134053155779839
[2024-08-07 09:22:31,827][flwr][INFO] - 		round 2: 0.4680697446068128
[2024-08-07 09:22:31,827][flwr][INFO] - 		round 3: 0.4471299077073733
[2024-08-07 09:22:31,827][flwr][INFO] - 		round 4: 0.4267723460992177
[2024-08-07 09:22:31,827][flwr][INFO] - 		round 5: 0.40600505967934925
[2024-08-07 09:22:31,827][flwr][INFO] - 		round 6: 0.3859519263108571
[2024-08-07 09:22:31,827][flwr][INFO] - 	History (metrics, centralized):
[2024-08-07 09:22:31,827][flwr][INFO] - 	{'all_dice_liver': [(0, tensor(0.1261, dtype=torch.float64)),
[2024-08-07 09:22:31,828][flwr][INFO] - 	                    (1, tensor(0.2132, dtype=torch.float64)),
[2024-08-07 09:22:31,828][flwr][INFO] - 	                    (2, tensor(0.2466, dtype=torch.float64)),
[2024-08-07 09:22:31,828][flwr][INFO] - 	                    (3, tensor(0.2342, dtype=torch.float64)),
[2024-08-07 09:22:31,828][flwr][INFO] - 	                    (4, tensor(0.2524, dtype=torch.float64)),
[2024-08-07 09:22:31,828][flwr][INFO] - 	                    (5, tensor(0.2540, dtype=torch.float64)),
[2024-08-07 09:22:31,828][flwr][INFO] - 	                    (6, tensor(0.2742, dtype=torch.float64))],
[2024-08-07 09:22:31,828][flwr][INFO] - 	 'all_dice_tumour': [(0, tensor(0.0005, dtype=torch.float64)),
[2024-08-07 09:22:31,828][flwr][INFO] - 	                     (1, tensor(0.0005, dtype=torch.float64)),
[2024-08-07 09:22:31,828][flwr][INFO] - 	                     (2, tensor(0.0004, dtype=torch.float64)),
[2024-08-07 09:22:31,828][flwr][INFO] - 	                     (3, tensor(0.0004, dtype=torch.float64)),
[2024-08-07 09:22:31,828][flwr][INFO] - 	                     (4, tensor(0.0003, dtype=torch.float64)),
[2024-08-07 09:22:31,828][flwr][INFO] - 	                     (5, tensor(0.0004, dtype=torch.float64)),
[2024-08-07 09:22:31,828][flwr][INFO] - 	                     (6, tensor(0.0003, dtype=torch.float64))],
[2024-08-07 09:22:31,828][flwr][INFO] - 	 'all_iou': [(0, 0.03681761232606806),
[2024-08-07 09:22:31,828][flwr][INFO] - 	             (1, 0.4644223632215021),
[2024-08-07 09:22:31,828][flwr][INFO] - 	             (2, 0.8215379230317509),
[2024-08-07 09:22:31,828][flwr][INFO] - 	             (3, 0.8423317316941917),
[2024-08-07 09:22:31,829][flwr][INFO] - 	             (4, 0.827601091186032),
[2024-08-07 09:22:31,829][flwr][INFO] - 	             (5, 0.8808610053412292),
[2024-08-07 09:22:31,829][flwr][INFO] - 	             (6, 0.833554796896432)]}
[2024-08-07 09:22:31,829][flwr][INFO] - 
